{
  "format_version": "1",
  "inventory_generation": 1,
  "previous_inventory_digest": null,
  "issued_at": "2026-09-17T19:55:00Z",
  "environment": "staging",
  "root_key_id": "tiamat-trust-root-staging-1",
  "keys": [
    {
      "kid": "release-key-staging-1",
      "issuer": "stoin-control",
      "environment": "staging",
      "purpose": "policy_notary_v13",
      "use": "tiamat-signed-release",
      "algorithm": "EdDSA",
      "public_key_b64": "AAAAAAAAAAAAAAAAAAAAAAAAAAAAAAAAAAAAAAAAAAA=",
      "status": "active",
      "valid_from": "2026-09-17T19:55:00Z",
      "issuance_not_after": "2026-09-19T08:05:00Z",
      "verify_not_after": "2026-09-20T08:05:00Z",
      "revoked_at": null,
      "active_release_policy": "invalidate_immediately",
      "authorized_scopes": [
        {
          "caller_id": "stoin:synth:utopia-homes",
          "realm": "utopia-homes",
          "release_type": "execution_profile",
          "subject_id": "utopia-homes.public-answer.generate.v1"
        }
      ]
    }
  ]
}
